{
  "$schema": "https://json-schema.org/draft/2020-12/schema",
  "$id": "https://agents.local/schemas/attack-record/1",
  "title": "Criteria attack record",
  "description": "Record of one attack round over a document's acceptance criteria: the revision attacked, which lenses reported, the objections they raised, and how each was adjudicated.",
  "type": "object",
  "additionalProperties": false,
  "required": [
    "schema_version",
    "spec_path",
    "spec_revision",
    "lenses",
    "objections",
    "dispositions"
  ],
  "properties": {
    "schema_version": {
      "const": "1"
    },
    "spec_path": {
      "type": "string",
      "pattern": "\\S",
      "description": "The attacked document, which this record is committed beside. A bare filename: the record's own directory is the only one searched, so a path leading out of it names a document no attacker in the round read."
    },
    "spec_revision": {
      "$ref": "#/$defs/revision",
      "description": "Revision of the document this round attacked."
    },
    "lenses": {
      "type": "array",
      "minItems": 1,
      "items": {
        "type": "object",
        "additionalProperties": false,
        "required": ["lens", "report"],
        "properties": {
          "lens": {"type": "string", "pattern": "\\S"},
          "report": {"enum": ["objections", "empty"]},
          "workings": {
            "type": "object",
            "description": "The inventory a lens returns beside its objections when its front matter requires workings, judged against the schema beside that lens's prompt."
          }
        }
      },
      "description": "One entry per lens that reported, empty reports included. A lens that errored or returned unreadable output has no entry, and the round is unfinished."
    },
    "objections": {
      "type": "array",
      "items": {"$ref": "#/$defs/objection"},
      "description": "The union of the lens reports. Each objection carries the id its disposition names."
    },
    "dispositions": {
      "type": "array",
      "items": {"$ref": "#/$defs/disposition"},
      "description": "One entry per objection id."
    }
  },
  "$defs": {
    "revision": {
      "type": "string",
      "pattern": "^(sha256:[0-9a-f]{64}|[0-9a-f]{40})$",
      "description": "Content-addressed revision of the document: sha256: followed by the hex digest of its bytes, or the 40-hex object id of the same content. Written with no surrounding whitespace — git hash-object ends its output with a newline, which the pattern above does not catch and the checker refuses."
    },
    "objection": {
      "type": "object",
      "additionalProperties": false,
      "required": ["id", "lens", "target_ac", "ground", "objection", "scenario"],
      "properties": {
        "id": {
          "type": "string",
          "pattern": "\\S",
          "description": "Identifies this objection to its disposition. Assigned when the lens reports are unioned, and distinct within the round: dropping a malformed objection renumbers positions, so a disposition keyed on position would adjudicate a different objection after the edit."
        },
        "lens": {
          "type": "string",
          "pattern": "\\S",
          "description": "The attack lens that produced this objection."
        },
        "target_ac": {
          "type": "string",
          "pattern": "\\S",
          "description": "Identifier of the criterion attacked, or \"none\" when no criterion covers the ground at all."
        },
        "ground": {
          "type": "object",
          "additionalProperties": false,
          "required": ["rule", "reason"],
          "properties": {
            "rule": {"type": "string", "pattern": "\\S", "description": "The ID of the acceptance-criteria rule the criteria as written break, one the producing lens enforces."},
            "reason": {"type": "string", "pattern": "\\S", "description": "Why the criteria break that rule."}
          },
          "description": "The rule of the acceptance-criteria standard that the criteria as written break, and the reason."
        },
        "obligation": {
          "type": "string",
          "pattern": "\\S",
          "description": "Optional. The obligation, or the part of one, that the objection concerns, for a lens whose instructions name obligations."
        },
        "objection": {
          "type": "string",
          "pattern": "\\S",
          "description": "What the criteria as written let through."
        },
        "scenario": {
          "type": "object",
          "additionalProperties": false,
          "required": ["given", "when", "expect"],
          "properties": {
            "given": {"type": "string", "pattern": "\\S"},
            "when": {"type": "string", "pattern": "\\S"},
            "expect": {"type": "string", "pattern": "\\S"}
          },
          "description": "The scenario that shows the objection. All three parts are required and non-blank: an item that cannot name a starting state, an action, and an observable outcome is a concern rather than a testable claim, and is not an objection."
        }
      }
    },
    "disposition": {
      "type": "object",
      "additionalProperties": false,
      "required": ["id", "disposition"],
      "properties": {
        "id": {
          "type": "string",
          "pattern": "\\S",
          "description": "Id of the objection this adjudicates."
        },
        "disposition": {"enum": ["accepted", "rejected"]},
        "rationale": {
          "type": "string",
          "pattern": "\\S",
          "description": "Why. Required on a rejection."
        },
        "revision": {
          "$ref": "#/$defs/revision",
          "description": "Revision of the document that carries an accepted objection. Required on an acceptance, different from the revision attacked, and the same on every acceptance in the record: the document reached one state once all of them were in it, so per-acceptance revisions name states it was never in and the check refuses the round."
        },
        "covering_ac": {
          "type": "string",
          "pattern": "\\S",
          "description": "Identifier of the criterion in that revision which answers the objection, written by the document's author. Required on an acceptance."
        }
      },
      "allOf": [
        {
          "if": {"required": ["disposition"], "properties": {"disposition": {"const": "accepted"}}},
          "then": {"required": ["revision", "covering_ac"]}
        },
        {
          "if": {"required": ["disposition"], "properties": {"disposition": {"const": "rejected"}}},
          "then": {"required": ["rationale"]}
        }
      ],
      "description": "Each verdict carries the fields that make it an adjudication: an acceptance the revision and criterion that now carry the objection, a rejection the reason it was not taken."
    }
  }
}
