{
  "dispositions": [
    {
      "disposition": "rejected",
      "id": "behavioural-outcome-1",
      "rationale": "The runner write log is the named evidence; a log that omits a write is the same attestation problem as a report that lies about its model, and the tree cannot see past either."
    },
    {
      "disposition": "rejected",
      "id": "obligation-reduction-1",
      "rationale": "A case pass or fail is its lock (ACE-D7, ACE-D8); there is no separate outcome store for an experiment to touch."
    },
    {
      "covering_ac": "ARM-A6",
      "disposition": "accepted",
      "id": "obligation-reduction-2",
      "rationale": "Isolation joins the fields ARM-A6 checks; the orchestrator arm runs in the authoring context, the subagent arm fresh, both recorded on the dispatch.",
      "revision": "sha256:628079c4d8e22b27286a7f820f2c8135c74a403ad4d1a1b806acf6ca5b07b4d5"
    },
    {
      "covering_ac": "ARM-A7",
      "disposition": "accepted",
      "id": "obligation-reduction-3",
      "rationale": "A self-check run records the criteria before and after the self-check, and the scorer refuses one lacking both.",
      "revision": "sha256:628079c4d8e22b27286a7f820f2c8135c74a403ad4d1a1b806acf6ca5b07b4d5"
    },
    {
      "covering_ac": "ARM-A7",
      "disposition": "accepted",
      "id": "obligation-reduction-4",
      "rationale": "Same; isolation under ARM-A6.",
      "revision": "sha256:628079c4d8e22b27286a7f820f2c8135c74a403ad4d1a1b806acf6ca5b07b4d5"
    },
    {
      "covering_ac": "ARM-A7",
      "disposition": "accepted",
      "id": "obligation-reduction-5",
      "rationale": "A plan whose objection set holds an objection without a decision is refused.",
      "revision": "sha256:628079c4d8e22b27286a7f820f2c8135c74a403ad4d1a1b806acf6ca5b07b4d5"
    },
    {
      "covering_ac": "ARM-A7",
      "disposition": "accepted",
      "id": "obligation-reduction-6",
      "rationale": "A plan whose arm 2 ledger lacks a rationale is refused.",
      "revision": "sha256:628079c4d8e22b27286a7f820f2c8135c74a403ad4d1a1b806acf6ca5b07b4d5"
    },
    {
      "covering_ac": "ARM-A10",
      "disposition": "accepted",
      "id": "obligation-reduction-7",
      "rationale": "For arm 3 the adjudication record must hold the held-out objections listed and none adjudicated.",
      "revision": "sha256:628079c4d8e22b27286a7f820f2c8135c74a403ad4d1a1b806acf6ca5b07b4d5"
    },
    {
      "covering_ac": "ARM-A10",
      "disposition": "accepted",
      "id": "obligation-reduction-8",
      "rationale": "Same.",
      "revision": "sha256:628079c4d8e22b27286a7f820f2c8135c74a403ad4d1a1b806acf6ca5b07b4d5"
    },
    {
      "covering_ac": "ARM-A2",
      "disposition": "accepted",
      "id": "obligation-reduction-9",
      "rationale": "The report gives the held-out count for arm 3.",
      "revision": "sha256:628079c4d8e22b27286a7f820f2c8135c74a403ad4d1a1b806acf6ca5b07b4d5"
    },
    {
      "disposition": "rejected",
      "id": "obligation-reduction-10",
      "rationale": "Writing the plan before dispatch rests on the operator, as ARM-D3 states; nothing in the committed tree can observe it."
    },
    {
      "disposition": "rejected",
      "id": "obligation-reduction-11",
      "rationale": "Committing every run rests on the operator, as ARM-D3 states; nothing in the committed tree can observe it."
    },
    {
      "disposition": "rejected",
      "id": "obligation-reduction-12",
      "rationale": "The runner write log is the named evidence; a log that omits a write is the same attestation problem as a report that lies about its model, and the tree cannot see past either."
    },
    {
      "covering_ac": "ARM-A12",
      "disposition": "accepted",
      "id": "obligation-reduction-13",
      "rationale": "Inputs are stripped of any field naming a lens, arm or model.",
      "revision": "sha256:628079c4d8e22b27286a7f820f2c8135c74a403ad4d1a1b806acf6ca5b07b4d5"
    },
    {
      "disposition": "rejected",
      "id": "obligation-reduction-14",
      "rationale": "An unplanned repeat matches nothing under ARM-A7 and leaves no usable report the scorer reads; the tree sees only committed reports, and the plan fixes the count."
    },
    {
      "covering_ac": "ARM-A2",
      "disposition": "accepted",
      "id": "set-consistency-1",
      "rationale": "ARM-D2: a held-out objection reaches the adjudicator as a listed repeat, so a seeded wrong rejection listed counts as reaching adjudication for overturnability, while counting in neither repeats nor effort.",
      "revision": "sha256:628079c4d8e22b27286a7f820f2c8135c74a403ad4d1a1b806acf6ca5b07b4d5"
    },
    {
      "covering_ac": "ARM-A6",
      "disposition": "accepted",
      "id": "set-consistency-2",
      "rationale": "The plan fixes each arm prompt from the emitter at plan time; the scorer compares the run to the plan, not to the emitter later.",
      "revision": "sha256:628079c4d8e22b27286a7f820f2c8135c74a403ad4d1a1b806acf6ca5b07b4d5"
    },
    {
      "covering_ac": "ARM-A6",
      "disposition": "accepted",
      "id": "what-if-1",
      "rationale": "Same.",
      "revision": "sha256:628079c4d8e22b27286a7f820f2c8135c74a403ad4d1a1b806acf6ca5b07b4d5"
    },
    {
      "covering_ac": "ARM-A7",
      "disposition": "accepted",
      "id": "what-if-2",
      "rationale": "Usable reports match the plan one to one; a repeat superseded reports match nothing.",
      "revision": "sha256:628079c4d8e22b27286a7f820f2c8135c74a403ad4d1a1b806acf6ca5b07b4d5"
    },
    {
      "covering_ac": "ARM-A2",
      "disposition": "accepted",
      "id": "what-if-3",
      "rationale": "The held-out count is reported for arm 3.",
      "revision": "sha256:628079c4d8e22b27286a7f820f2c8135c74a403ad4d1a1b806acf6ca5b07b4d5"
    },
    {
      "covering_ac": "ARM-A7",
      "disposition": "accepted",
      "id": "what-if-4",
      "rationale": "A plan whose run-id a committed run already holds is refused; ARM-D3 gives one run-id per run.",
      "revision": "sha256:628079c4d8e22b27286a7f820f2c8135c74a403ad4d1a1b806acf6ca5b07b4d5"
    }
  ],
  "lenses": [
    {
      "lens": "behavioural-outcome",
      "report": "objections"
    },
    {
      "lens": "obligation-reduction",
      "report": "objections",
      "workings": {
        "criteria": [
          "ARM-A1",
          "ARM-A2",
          "ARM-A3",
          "ARM-A4",
          "ARM-A5",
          "ARM-A6",
          "ARM-A7",
          "ARM-A8",
          "ARM-A9",
          "ARM-A10",
          "ARM-A11",
          "ARM-A12"
        ],
        "obligations": [
          {
            "id": "O1",
            "kind": "guarantee",
            "parts": [
              {
                "discharged_by": [
                  "ARM-A8"
                ],
                "id": "O1.1",
                "statement": "The evaluation of record's locks are identical before and after an experiment."
              },
              {
                "discharged_by": [],
                "id": "O1.2",
                "statement": "Experiment scores remain separate from the evaluation of record and change no case's pass or fail."
              }
            ],
            "source": "Problem statement: \"The experiments' results are therefore scored apart from it, and they change no case's pass or fail.\" ARM-D3: \"the evaluation of record's locks are the same before and after it.\"",
            "statement": "The experiments remain separate from the evaluation of record and preserve its decisions and locks."
          },
          {
            "id": "O2",
            "kind": "guarantee",
            "parts": [
              {
                "discharged_by": [],
                "id": "O2.1",
                "statement": "Orchestrator authoring occurs in the context holding the objections and decisions."
              },
              {
                "discharged_by": [],
                "id": "O2.2",
                "statement": "The orchestrator self-check performs the specified read and edits before attack in that same context."
              },
              {
                "discharged_by": [],
                "id": "O2.3",
                "statement": "The subagent authors and performs the specified self-check in a fresh context containing only the prescribed inputs."
              }
            ],
            "source": "ARM-D1: \"The orchestrator authors the criteria in the context that holds the objections and decisions.\" The self-check is \"one read ... against ... one-obligation, observable-obligation and consistency rules, with edits, before the attack\"; the orchestrator uses \"the same context\" and the subagent uses \"a fresh context given only the document, the objections with their decisions, and the standard.\"",
            "statement": "The authoring arms execute the distinct authoring and self-check processes defined in ARM-D1."
          },
          {
            "id": "O3",
            "kind": "guarantee",
            "parts": [
              {
                "discharged_by": [
                  "ARM-A7"
                ],
                "id": "O3.1",
                "statement": "The runs use the planned pinned document and fixed objection set, one planned model, three authoring results per arm, and the required full-panel attack counts and membership."
              },
              {
                "discharged_by": [],
                "id": "O3.2",
                "statement": "The fixed authoring objection set consists of accepted objections accompanied by the author's decisions."
              }
            ],
            "source": "ARM-D1: \"Each arm gets one document at a pinned revision and one fixed set of accepted objections with the author's decisions. Each authors three times with one model named in the run plan. The full panel attacks each result once ...\"",